{
  "agreement_site": "be",
  "cell": {
    "aspect": "progressive",
    "clause": "declarative",
    "modal": "none",
    "polarity": "positive",
    "tense": "present",
    "voice": "active"
  },
  "operations": [
    "be_support",
    "progressive_participle"
  ],
  "predicate_class": "lexical_transitive"
}
